dates,CAR25,dd95,ddTol,dpsCommission,dpsNetEquity,dpsNetPNL,dpsRunName,dpsSafef,gainAhead,is_period,netEquity,netPNL,nodpsComm,nodpsSafef,signalType,signals,v4.4_system,safef,mrThreshold,timestamp
2016-07-01,-0.00693965707396,0.0,0.00161514570617,6.39869726904,106638.56,-879.72,both_gainAhead_PCA10_VotingSoft DPS wl3.0 maxL2 dd95_0.002 thres_0.0,1.0,-0.0218721037998,wf_is_pv3s_v2v,104345.76,-429.7,4.17399746502,1.0,gainAhead_PCA10_VotingSoft,-1.0,gainAhead_PCA10_f10_is10,1.0,,
2016-07-05,0.0126317402967,0.00619934940846,0.00186500961648,2.17941939307,108968.79,2330.23,both_gainAhead_PCA10_VotingSoft DPS wl4.0 maxL2 dd95_0.002 thres_0.0,2.0,0.0,wf_is_pv3s_v2v,106628.02,2282.26,0.0,1.0,gainAhead_PCA10_VotingSoft,-1.0,gainAhead_PCA10_f10_is10,1.0,0.75,20160705 23:14:57 EDT
2016-07-06 00:00:00,-0.0106876022721,0.0,0.00131876094679,2.16863792416,108429.73,-539.06,both_gainAhead_PCA10_VotingSoft DPS wl2.0 maxL2 dd95_0.001 thres_0.0,1.0,0.0,wf_is_pv3s_v2v,106365.34,-262.68,0.0,1.0,gainAhead_PCA10_VotingSoft,-1.0,gainAhead_PCA10_f10_is10,1.0,0.75,20160706 21:03:07 EDT
2016-07-07 00:00:00,0.022233179836,5.09993400044e-05,0.00161514570617,0.0,106489.98,1194.28,both_gainAhead_VotingSoft DPS wl3.0 maxL2 dd95_0.002 thres_0.0,2.0,0.0,wf_is_pv2e_p2p,103427.94,583.24,0.0,1.0,gainAhead_VotingSoft,-1.0,gainAhead_VotingSoft_f93_is39,1.0,0.75,20160707 21:33:11 EDT
2016-07-08 00:00:00,0.0693830167703,0.0012823688439,0.00186500961648,8.73033315772,109120.43,4257.55,both_gainAhead_GNBayes DPS wl4.0 maxL2 dd95_0.002 thres_0.0,2.0,0.0,wf_is_short,105013.2,2089.49,4.20069620966,1.0,gainAhead_GNBayes,-1.0,gainAhead_GNBayes_f86_is8,1.0,0.75,20160708 21:01:49 EDT
