dates,CAR25,dd95,ddTol,dpsCommission,dpsNetEquity,dpsNetPNL,dpsRunName,dpsSafef,gainAhead,is_period,netEquity,netPNL,nodpsComm,nodpsSafef,signalType,signals,v4.4_system,safef,mrThreshold,timestamp
2016-06-29,0.0527246305558,0.0,0.00114208048144,0.0,128713.69,4735.0,both_gainAhead_GNBayes DPS wl1.5 maxL2 dd95_0.001 thres_0.0,2.0,0.0101426852329,wf_is_short,114170.78,2139.35,0.0,1.0,gainAhead_GNBayes,1.0,gainAhead_GNBayes_f86_is4,1.0,,
2016-06-30,0.0417472666505,7.09986800177e-05,0.00131876094679,10.5059755909,131314.19,2600.5,both_gainAhead_GNBayes DPS wl2.0 maxL2 dd95_0.001 thres_0.0,2.0,0.0,wf_is_short,115324.17,1153.39,4.61315113137,1.0,gainAhead_GNBayes,-1.0,gainAhead_GNBayes_f86_is3,1.0,1.0,20160701 00:21:47 EDT
2016-07-01 00:00:00,0.0328651558425,6e-05,0.00161514570617,0.0,109827.38,1292.96,both_zigZag_PCA10_VotingSoft DPS wl3.0 maxL2 dd95_0.002 thres_0.0,2.0,0.0,wf_is_pv3s_v2v,106107.27,628.28,0.0,1.0,zigZag_PCA10_VotingSoft,1.0,zigZag_PCA10_f10_is37,1.0,1.0,20160701 20:47:26 EDT
2016-07-01 00:00:00,0.0356682552231,5.9998800008e-05,0.00161514570617,0.0,109827.38,1292.96,both_zigZag_PCA10_VotingSoft DPS wl3.0 maxL2 dd95_0.002 thres_0.0,2.0,0.0,wf_is_pv3s_v2v,106107.27,628.28,0.0,1.0,zigZag_PCA10_VotingSoft,1.0,zigZag_PCA10_f10_is37,1.0,1.0,20160704 20:23:19 EDT
2016-07-05 00:00:00,0.00024497318396,0.00139403876305,0.00186500961648,2.15876448486,107936.07,705.34,both_gainAhead_GNBayes DPS wl4.0 maxL2 dd95_0.002 thres_0.0,2.0,0.0,wf_is_short,105538.28,691.76,0.0,1.0,gainAhead_GNBayes,-1.0,gainAhead_GNBayes_f86_is5,1.0,1.0,20160705 20:29:11 EDT
2016-07-05 00:00:00,0.00146152115263,0.00626445466603,0.00186500961648,2.15876448486,107936.07,705.34,both_gainAhead_GNBayes DPS wl4.0 maxL2 dd95_0.002 thres_0.0,2.0,0.0,wf_is_short,105538.28,691.76,0.0,1.0,gainAhead_GNBayes,-1.0,gainAhead_GNBayes_f86_is5,1.0,1.0,20160705 23:02:59 EDT
2016-07-06 00:00:00,0.000341536549575,0.00220992705132,0.00208514414057,2.18499125531,109247.38,871.42,both_zigZag_PCA10_VotingSoft DPS wl5.0 maxL2 dd95_0.002 thres_0.0,2.0,0.0,wf_is_pv3s_v2v,106256.86,849.67,0.0,1.0,zigZag_PCA10_VotingSoft,1.0,zigZag_PCA10_f10_is37,1.0,1.0,20160706 21:03:14 EDT
