dates,CAR25,dd95,ddTol,dpsCommission,dpsNetEquity,dpsNetPNL,dpsRunName,dpsSafef,gainAhead,is_period,netEquity,netPNL,nodpsComm,nodpsSafef,signalType,signals,v4.4_system,safef,mrThreshold,timestamp
2016-06-29,0.0546413625676,0.0,0.0029488391231,0.0,103484.3,1179.79,both_zigZag_PCA10_VotingSoft DPS wl10.0 maxL2 dd95_0.003 thres_0.0,2.0,0.0149467649468,wf_is_pv3s_v2v,102409.35,587.11,0.0,1.0,zigZag_PCA10_VotingSoft,1.0,zigZag_PCA10_f10_is23,1.0,,
2016-06-30,0.0569154267288,5.99994600036e-05,0.00161514570617,0.0,106577.81,3093.51,both_zigZag_PCA10_VotingSoft DPS wl3.0 maxL2 dd95_0.002 thres_0.0,2.0,0.0,wf_is_pv3s_v2v,103940.04,1530.69,0.0,1.0,zigZag_PCA10_VotingSoft,1.0,zigZag_PCA10_f10_is23,1.0,1.0,20160701 00:11:10 EDT
2016-06-30 00:00:00,0.0569154279672,7.09986800175e-05,0.00161514570617,0.0,106577.81,3093.51,both_zigZag_PCA10_VotingSoft DPS wl3.0 maxL2 dd95_0.002 thres_0.0,2.0,0.0,wf_is_pv3s_v2v,103940.04,1530.69,0.0,1.0,zigZag_PCA10_VotingSoft,1.0,zigZag_PCA10_f10_is23,1.0,1.0,20160701 20:40:38 EDT
2016-07-04 00:00:00,0.0139167036891,5.09993400044e-05,0.00186500961648,8.5977781839,107463.63,894.35,both_zigZag_PCA10_VotingSoft DPS wl4.0 maxL2 dd95_0.002 thres_0.0,2.0,0.0,wf_is_pv2e_p2p,104372.02,436.14,4.17504789703,1.0,zigZag_PCA10_VotingSoft,1.0,zigZag_PCA10_f10_is9,1.0,1.0,20160704 20:36:13 EDT
2016-07-05 00:00:00,0.114919447848,3.99998200001e-05,0.00208514414057,0.0,109918.65,4485.6,both_gainAhead_GNBayes DPS wl5.0 maxL2 dd95_0.002 thres_0.0,2.0,0.0,wf_is_short,105578.31,2199.11,0.0,1.0,gainAhead_GNBayes,-1.0,gainAhead_GNBayes_f86_is6,1.0,1.0,20160705 20:29:56 EDT
2016-07-05 00:00:00,0.105570081818,5.09993400044e-05,0.00208514414057,0.0,109292.08,4460.03,both_gainAhead_GNBayes DPS wl5.0 maxL2 dd95_0.002 thres_0.0,2.0,0.0,wf_is_short,105578.31,2199.11,0.0,1.0,gainAhead_GNBayes,-1.0,gainAhead_GNBayes_f86_is6,1.0,1.0,20160705 23:12:13 EDT
