dates,dpsNetEquity,netEquity,CAR25,dd95,ddTol,dpsCommission,dpsNetPNL,dpsRunName,dpsSafef,gainAhead,is_period,netPNL,nodpsComm,nodpsSafef,signalType,signals,v4.3_system,RS_netEquity,safef,cycleTime,timestamp
2016-05-03,74494.39,76327.75,-0.0249996084209,0.0,0.00884651736929,0.0,-2433.23,both_worst_wf_is_short DPS wl90.0 maxL2 dd95_0.009 thres_0.0,1.0,-0.0201005025126,wf_is_short,-2493.12,0.0,1.0,gainAhead_GNBayes,1.0,gainAhead_GNBayes_f51_is9,76327.75,1.0,,
2016-05-04,72997.02,74793.52,-0.0148226080268,0.0,0.00884651736929,0.0,-1497.37,both_worst_wf_is_all DPS wl90.0 maxL2 dd95_0.009 thres_0.0,1.0,0.0,wf_is_short,-1534.23,0.0,1.0,gainAhead_GNBayes,1.0,gainAhead_GNBayes_f52_is10,59880.1,1.0,2335.27808333,20160505 14:55:16 EDT
2016-05-04 00:00:00,66989.1,66421.18,-0.0391285081476,0.0,0.00884651736929,0.0,-1374.14,both_worst_wf_is_short DPS wl90.0 maxL2 dd95_0.009 thres_0.0,1.0,0.0,wf_is_short,-1362.49,0.0,1.0,gainAhead_PCA10_GNBayes,1.0,gainAhead_PCA10_f10_is10,69174.2,1.0,2390.13606667,20160505 15:50:08 EDT
2016-05-05 00:00:00,66406.3,84427.27,0.045727156986,0.00389236827515,0.00336219390073,0.0,1660.16,both_zigZag_VotingSoft DPS wl13.0 maxL2 dd95_0.003 thres_0.0,2.0,0.0,wf_is_pv3s_v2v,1068.7,0.0,1.0,zigZag_VotingSoft,-1.0,zigZag_VotingSoft_f59_is14,,1.0,1597.86256667,20160506 02:37:51 EDT
2016-05-05 00:00:00,103797.28,106947.8,0.00494446946273,0.00352149697327,0.00437383524868,0.0,-2731.51,both_gainAhead_PCA10_VotingSoft DPS wl22.0 maxL2 dd95_0.004 thres_0.0,2.0,0.0,wf_is_pv2e_p2p,-1388.93,0.0,1.0,gainAhead_PCA10_VotingSoft,1.0,gainAhead_PCA10_f10_is46,,1.0,2448.92716667,20160506 16:48:55 EDT
