dates,dpsNetEquity,netEquity,CAR25,dd95,ddTol,dpsCommission,dpsNetPNL,dpsRunName,dpsSafef,gainAhead,is_period,netPNL,nodpsComm,nodpsSafef,signalType,signals,v4.3_system,RS_netEquity,safef,cycleTime,timestamp
2016-04-28 23:00:00,99998.0,99998.0,0.0,0.0,0.00361157559257,2.0,-2.0,both_best_wf_is_pv3s_v2v DPS wl15.0 maxL2 dd95_0.004 thres_0.0,1.0,-0.000315579205345,wf_is_pv3s_v2v,-2.0,2.0,1.0,buyHold,1.0,buyHold,99998.0,1.0,,
2016-04-28 23:30:00,99966.44,99966.44,-0.00399996,0.0,0.00361157559257,0.0,-31.56,both_best_wf_is_pv3s_v2v DPS wl15.0 maxL2 dd95_0.004 thres_0.0,1.0,0.0,wf_is_pv3s_v2v,-31.56,0.0,1.0,buyHold,1.0,buyHold,99966.44,1.0,-14.97525,20160428 23:15:01 EDT
2016-04-29 08:30:00,99984.6,99969.2,-0.00399996,0.0,0.00373001923296,0.0,-13.4,both_best_wf_is_pv3s_v2v DPS wl16.0 maxL2 dd95_0.004 thres_0.0,1.0,0.0,wf_is_pv3s_v2v,-26.8,0.0,2.0,buyHold,1.0,buyHold,99969.2,2.0,-4.78788333333,20160429 08:25:12 EDT
2016-04-29 17:00:00,100067.44,100134.87,0.0,0.0,0.00502169207582,0.0,69.44,both_buyHold DPS wl29.0 maxL2 dd95_0.005 thres_0.0,1.0,0.0,wf_is_pv2e_p2p,138.87,0.0,2.0,buyHold,1.0,buyHold,,2.0,0.61,20160501 06:48:32 EDT
2016-04-29 17:00:00,100067.44,100134.87,0.0,0.0,0.00502169207582,0.0,69.44,both_buyHold DPS wl29.0 maxL2 dd95_0.005 thres_0.0,1.0,0.0,wf_is_pv2e_p2p,138.87,0.0,2.0,buyHold,1.0,buyHold,,2.0,0.58,20160501 07:26:34 EDT
