dates,CAR25,dd95,ddTol,dpsCommission,dpsNetEquity,dpsNetPNL,dpsRunName,dpsSafef,gainAhead,is_period,netEquity,netPNL,nodpsComm,nodpsSafef,signalType,signals,v4.4_system,safef,cycleTime,timestamp
2016-06-10,0.00397671137922,0.00273152236425,0.00336219390073,0.0,113450.24,767.2,both_gainAhead_PCA10_VotingSoft DPS wl13.0 maxL2 dd95_0.003 thres_0.0,2.0,-0.00835671587166,wf_is_pv2e_p2p,107137.66,363.49,0.0,1.0,gainAhead_PCA10_VotingSoft,-1.0,gainAhead_PCA10_f10_is15,1.0,,
2016-06-13,0.0175076681428,0.00814164594211,0.00348911350395,0.0,115346.38,1896.14,both_gainAhead_PCA10_VotingSoft DPS wl14.0 maxL2 dd95_0.003 thres_0.0,2.0,0.0,wf_is_pv2e_p2p,108032.98,895.32,0.0,1.0,gainAhead_PCA10_VotingSoft,-1.0,gainAhead_PCA10_f10_is15,1.0,1292.71068333,20160613 21:32:42 EDT
2016-06-13 00:00:00,0.0041736541643,0.00330192070697,0.00348911350395,0.0,114684.34,1885.26,both_gainAhead_PCA10_VotingSoft DPS wl14.0 maxL2 dd95_0.003 thres_0.0,2.0,0.0,wf_is_pv2e_p2p,108032.98,895.32,0.0,1.0,gainAhead_PCA10_VotingSoft,-1.0,gainAhead_PCA10_f10_is15,1.0,1879.4747,20160614 07:19:28 EDT
2016-06-14 00:00:00,0.0177404381171,5.1e-05,0.00186500961648,0.0,112717.18,304.25,both_gainAhead_PCA10_VotingSoft DPS wl4.0 maxL2 dd95_0.002 thres_0.0,2.0,0.0,wf_is_pv2e_p2p,108179.18,146.2,0.0,1.0,gainAhead_PCA10_VotingSoft,-1.0,gainAhead_PCA10_f10_is15,1.0,1263.30278333,20160614 21:03:18 EDT
2016-06-15 00:00:00,0.000374288708094,0.00249304118965,0.00208514414057,2.27190344229,113592.9,1304.93,both_zigZag_GNBayes DPS wl5.0 maxL2 dd95_0.002 thres_0.0,2.0,0.0,wf_is_short,107219.79,1233.84,0.0,1.0,zigZag_GNBayes,1.0,zigZag_GNBayes_f86_is30,1.0,1571.52656667,20160616 02:11:31 EDT
