dates,CAR25,dd95,ddTol,dpsCommission,dpsNetEquity,dpsNetPNL,dpsRunName,dpsSafef,gainAhead,is_period,netEquity,netPNL,nodpsComm,nodpsSafef,signalType,signals,v4.3_system,safef,cycleTime,timestamp
2016-05-27,-0.0125797072494,0.0,0.00246717581898,0.0,102942.62,118.72,both_gainAhead_PCA10_VotingSoft DPS wl7.0 maxL2 dd95_0.002 thres_0.0,1.0,-8.14597588792e-05,wf_is_pv2e_p2p,101904.09,117.53,0.0,1.0,gainAhead_PCA10_VotingSoft,-1.0,gainAhead_PCA10_f10_is21,1.0,,
2016-05-31,-0.00168967169885,0.0,0.00263752189358,0.0,102951.01,8.39,both_gainAhead_PCA10_VotingSoft DPS wl8.0 maxL2 dd95_0.003 thres_0.0,1.0,0.0,wf_is_pv2e_p2p,101912.39,8.3,0.0,1.0,gainAhead_PCA10_VotingSoft,-1.0,gainAhead_PCA10_f10_is21,1.0,1415.15141667,20160531 23:35:09 EDT
2016-06-01 00:00:00,0.0105793451875,0.00233934736715,0.00279751442472,2.05680856046,102838.37,564.51,both_buyHold DPS wl9.0 maxL2 dd95_0.003 thres_0.0,2.0,0.0,wf_is_short,102274.94,563.45,0.0,1.0,buyHold,1.0,buyHold,1.0,1344.59345,20160601 22:24:35 EDT
2016-06-01 00:00:00,0.019778296276,0.000166709899143,0.00279751442472,0.0,101440.7,1111.59,both_zigZag_PCA10_VotingSoft DPS wl9.0 maxL2 dd95_0.003 thres_0.0,2.0,0.0,wf_is_pv3s_v2v,100893.12,555.84,0.0,1.0,zigZag_PCA10_VotingSoft,1.0,zigZag_PCA10_f10_is31,1.0,1923.38778333,20160602 08:03:23 EDT
2016-06-02 00:00:00,0.0215378007849,0.000105165620459,0.00208514414057,0.0,101694.08,491.95,both_zigZag_PCA10_VotingSoft DPS wl5.0 maxL2 dd95_0.002 thres_0.0,2.0,0.0,wf_is_pv3s_v2v,100900.49,244.65,0.0,1.0,zigZag_PCA10_VotingSoft,1.0,zigZag_PCA10_f10_is31,1.0,1221.32855,20160602 20:21:19 EDT
