dates,CAR25,dd95,ddTol,dpsCommission,dpsNetEquity,dpsNetPNL,dpsRunName,dpsSafef,gainAhead,is_period,netEquity,netPNL,nodpsComm,nodpsSafef,signalType,signals,v4.3_system,safef,cycleTime,timestamp
2016-05-30,0.00643214203817,0.00142216583617,0.00186500961648,9.34237715906,155696.94,1105.64,both_gainAhead_PCA10_GNBayes DPS wl4.0 maxL2 dd95_0.002 thres_0.0,2.0,-0.00890265144184,wf_is_short,131035.19,933.12,5.24161712039,1.0,gainAhead_PCA10_GNBayes,-1.0,gainAhead_PCA10_f10_is15,1.0,,
2016-05-31,0.0448151801535,0.00116979682694,0.00208514414057,0.0,158469.17,2772.23,both_gainAhead_PCA10_GNBayes DPS wl5.0 maxL2 dd95_0.002 thres_0.0,2.0,0.0,wf_is_short,132201.75,1166.56,0.0,1.0,gainAhead_PCA10_GNBayes,-1.0,gainAhead_PCA10_f10_is16,1.0,1401.10298333,20160531 23:21:06 EDT
2016-06-01 00:00:00,-0.00178314911536,0.0,0.00228416096288,0.0,116513.35,395.67,both_zigZag_PCA10_VotingSoft DPS wl6.0 maxL2 dd95_0.002 thres_0.0,1.0,0.0,wf_is_pv2e_p2p,115767.76,393.14,0.0,1.0,zigZag_PCA10_VotingSoft,-1.0,zigZag_PCA10_f10_is27,1.0,1346.59806667,20160601 22:26:35 EDT
2016-06-01 00:00:00,-0.00345814500592,0.0,0.00228416096288,0.0,106157.99,360.5,both_zigZag_PCA10_VotingSoft DPS wl6.0 maxL2 dd95_0.002 thres_0.0,1.0,0.0,wf_is_pv2e_p2p,104189.95,353.82,0.0,1.0,zigZag_PCA10_VotingSoft,-1.0,zigZag_PCA10_f10_is27,1.0,2515.47555,20160602 17:55:28 EDT
2016-06-02 00:00:00,0.0671913771255,0.00315970918271,0.00246717581898,8.77520447562,109681.28,1385.22,both_gainAhead_PCA10_GNBayes DPS wl7.0 maxL2 dd95_0.002 thres_0.0,2.0,0.0,wf_is_short,105512.91,670.55,4.2206851926,1.0,gainAhead_PCA10_GNBayes,-1.0,gainAhead_PCA10_f10_is18,1.0,1225.63206667,20160602 20:25:37 EDT
