dates,CAR25,dd95,ddTol,dpsCommission,dpsNetEquity,dpsNetPNL,dpsRunName,dpsSafef,gainAhead,is_period,netEquity,netPNL,nodpsComm,nodpsSafef,signalType,signals,v4.3_system,safef,cycleTime,timestamp
2016-05-30,0.0017564242498,7.99989200144e-05,0.00131876094679,6.68587213924,111424.52,145.22,both_gainAhead_VotingSoft DPS wl2.0 maxL2 dd95_0.001 thres_0.0,2.0,-0.0033196641281,wf_is_pv3s_v2v,107500.42,142.25,4.30018879056,1.0,gainAhead_VotingSoft,1.0,gainAhead_VotingSoft_f94_is23,1.0,,
2016-05-31,-0.0169835091792,0.0,0.00161514570617,6.64108416216,110678.09,-746.43,both_gainAhead_VotingSoft DPS wl3.0 maxL2 dd95_0.002 thres_0.0,1.0,0.0,wf_is_pv3s_v2v,107139.27,-361.15,4.28574218848,1.0,gainAhead_VotingSoft,-1.0,gainAhead_VotingSoft_f105_is46,1.0,1360.08163333,20160531 22:40:04 EDT
2016-06-01 00:00:00,0.0284883193243,0.00563019070986,0.00186500961648,2.29639555893,114817.48,1551.12,both_gainAhead_PCA10_GNBayes DPS wl4.0 maxL2 dd95_0.002 thres_0.0,2.0,0.0,wf_is_short,108225.22,1464.2,0.0,1.0,gainAhead_PCA10_GNBayes,1.0,gainAhead_PCA10_f10_is7,1.0,1346.41861667,20160601 22:26:25 EDT
2016-06-01 00:00:00,0.0284674796934,0.00547242957549,0.00186500961648,2.03085237625,101540.59,1371.76,both_zigZag_VotingSoft DPS wl4.0 maxL2 dd95_0.002 thres_0.0,2.0,0.0,wf_is_pv2e_p2p,102102.15,1381.36,0.0,1.0,zigZag_VotingSoft,1.0,zigZag_VotingSoft_f87_is9,1.0,2523.25673333,20160602 18:03:15 EDT
2016-06-02 00:00:00,0.0169973509577,0.0,0.00114208048144,0.0,101588.35,1241.25,both_zigZag_PCA10_VotingSoft DPS wl1.5 maxL2 dd95_0.001 thres_0.0,2.0,0.0,wf_is_pv3s_v2v,100967.71,620.62,0.0,1.0,zigZag_PCA10_VotingSoft,1.0,zigZag_PCA10_f10_is23,1.0,1233.41978333,20160602 20:33:25 EDT
